{
  "schema": "scorekeeper.rive-live-keyframes/v1",
  "source": {
    "path": "../production-v5-vector-master/canonical-dimensional-pixel.svg",
    "sha256": "52328d0b4178dd64095744ee415184ac7cff190f161fca502cd45fed297d1d75"
  },
  "canvas": {
    "width": 512,
    "height": 416
  },
  "fps": 60,
  "artboard": "ScoreKeeper Cup Hybrid A - Production Rig v2",
  "nodes": [
    {
      "name": "rig_root",
      "parent": null,
      "kind": "pivot",
      "transform": {
        "x": 0,
        "y": 0,
        "rotationDeg": 0,
        "scaleX": 1,
        "scaleY": 1,
        "opacity": 1,
        "pivot": {
          "x": 256,
          "y": 401
        }
      }
    },
    {
      "name": "rig_base",
      "parent": "rig_root",
      "kind": "pivot",
      "transform": {
        "x": 0,
        "y": 0,
        "rotationDeg": 0,
        "scaleX": 1,
        "scaleY": 1,
        "opacity": 1,
        "pivot": {
          "x": 256,
          "y": 401
        }
      }
    },
    {
      "name": "rig_stem",
      "parent": "rig_root",
      "kind": "pivot",
      "transform": {
        "x": 0,
        "y": 0,
        "rotationDeg": 0,
        "scaleX": 1,
        "scaleY": 1,
        "opacity": 1,
        "pivot": {
          "x": 255,
          "y": 325
        }
      }
    },
    {
      "name": "rig_handle_l",
      "parent": "rig_root",
      "kind": "pivot",
      "transform": {
        "x": 0,
        "y": 0,
        "rotationDeg": 0,
        "scaleX": 1,
        "scaleY": 1,
        "opacity": 1,
        "pivot": {
          "x": 88,
          "y": 150
        }
      }
    },
    {
      "name": "rig_handle_r",
      "parent": "rig_root",
      "kind": "pivot",
      "transform": {
        "x": 0,
        "y": 0,
        "rotationDeg": 0,
        "scaleX": 1,
        "scaleY": 1,
        "opacity": 1,
        "pivot": {
          "x": 422,
          "y": 150
        }
      }
    },
    {
      "name": "rig_tab",
      "parent": "rig_root",
      "kind": "pivot",
      "transform": {
        "x": 0,
        "y": 0,
        "rotationDeg": 0,
        "scaleX": 1,
        "scaleY": 1,
        "opacity": 1,
        "pivot": {
          "x": 463,
          "y": 72
        }
      }
    },
    {
      "name": "rig_cup",
      "parent": "rig_root",
      "kind": "pivot",
      "transform": {
        "x": 0,
        "y": 0,
        "rotationDeg": 0,
        "scaleX": 1,
        "scaleY": 1,
        "opacity": 1,
        "pivot": {
          "x": 255,
          "y": 245
        }
      }
    },
    {
      "name": "rig_hair",
      "parent": "rig_root",
      "kind": "nestedArtboard",
      "transform": {
        "x": 0,
        "y": 0,
        "rotationDeg": 0,
        "scaleX": 1,
        "scaleY": 1,
        "opacity": 1,
        "pivot": {
          "x": 254,
          "y": 89
        }
      }
    },
    {
      "name": "rig_badge",
      "parent": "rig_root",
      "kind": "pivot",
      "transform": {
        "x": 0,
        "y": 0,
        "rotationDeg": 0,
        "scaleX": 1,
        "scaleY": 1,
        "opacity": 1,
        "pivot": {
          "x": 118,
          "y": 81
        }
      }
    },
    {
      "name": "rig_eye_l",
      "parent": "rig_root",
      "kind": "pivot",
      "transform": {
        "x": 0,
        "y": 0,
        "rotationDeg": 0,
        "scaleX": 1,
        "scaleY": 1,
        "opacity": 1,
        "pivot": {
          "x": 196,
          "y": 147
        }
      }
    },
    {
      "name": "rig_eye_r",
      "parent": "rig_root",
      "kind": "pivot",
      "transform": {
        "x": 0,
        "y": 0,
        "rotationDeg": 0,
        "scaleX": 1,
        "scaleY": 1,
        "opacity": 1,
        "pivot": {
          "x": 312,
          "y": 147
        }
      }
    },
    {
      "name": "rig_mouth",
      "parent": "rig_root",
      "kind": "pivot",
      "transform": {
        "x": 0,
        "y": 0,
        "rotationDeg": 0,
        "scaleX": 1,
        "scaleY": 1,
        "opacity": 1,
        "pivot": {
          "x": 255,
          "y": 205
        }
      }
    },
    {
      "name": "asset_tab",
      "parent": "rig_tab",
      "kind": "asset",
      "source": "canonical-svg",
      "semanticPart": "tab",
      "sourceElementIndices": [
        0,
        1
      ],
      "transform": {
        "x": 0,
        "y": 0,
        "rotationDeg": 0,
        "scaleX": 1,
        "scaleY": 1,
        "opacity": 1,
        "pivot": {
          "x": 0,
          "y": 0
        }
      }
    },
    {
      "name": "asset_cup",
      "parent": "rig_cup",
      "kind": "asset",
      "source": "canonical-svg",
      "semanticPart": "cup",
      "sourceElementIndices": [
        2,
        3,
        20,
        21,
        22,
        23,
        24,
        25,
        29,
        30,
        31,
        32
      ],
      "transform": {
        "x": 0,
        "y": 0,
        "rotationDeg": 0,
        "scaleX": 1,
        "scaleY": 1,
        "opacity": 1,
        "pivot": {
          "x": 0,
          "y": 0
        }
      }
    },
    {
      "name": "asset_handle_l",
      "parent": "rig_handle_l",
      "kind": "asset",
      "source": "canonical-svg",
      "semanticPart": "handle_l",
      "sourceElementIndices": [
        4,
        5,
        6,
        7,
        8,
        9,
        10,
        11
      ],
      "transform": {
        "x": 0,
        "y": 0,
        "rotationDeg": 0,
        "scaleX": 1,
        "scaleY": 1,
        "opacity": 1,
        "pivot": {
          "x": 0,
          "y": 0
        }
      }
    },
    {
      "name": "asset_handle_r",
      "parent": "rig_handle_r",
      "kind": "asset",
      "source": "canonical-svg",
      "semanticPart": "handle_r",
      "sourceElementIndices": [
        12,
        13,
        14,
        15,
        16,
        17,
        18,
        19
      ],
      "transform": {
        "x": 0,
        "y": 0,
        "rotationDeg": 0,
        "scaleX": 1,
        "scaleY": 1,
        "opacity": 1,
        "pivot": {
          "x": 0,
          "y": 0
        }
      }
    },
    {
      "name": "asset_hair",
      "parent": "rig_hair",
      "kind": "asset",
      "source": "canonical-svg",
      "semanticPart": "hair",
      "sourceElementIndices": [
        26
      ],
      "transform": {
        "x": 0,
        "y": 0,
        "rotationDeg": 0,
        "scaleX": 1,
        "scaleY": 1,
        "opacity": 1,
        "pivot": {
          "x": 0,
          "y": 0
        }
      }
    },
    {
      "name": "asset_badge",
      "parent": "rig_badge",
      "kind": "asset",
      "source": "canonical-svg",
      "semanticPart": "badge",
      "sourceElementIndices": [
        27,
        28
      ],
      "transform": {
        "x": 0,
        "y": 0,
        "rotationDeg": 0,
        "scaleX": 1,
        "scaleY": 1,
        "opacity": 1,
        "pivot": {
          "x": 0,
          "y": 0
        }
      }
    },
    {
      "name": "asset_eye_l",
      "parent": "rig_eye_l",
      "kind": "asset",
      "source": "canonical-svg",
      "semanticPart": "eye_l",
      "sourceElementIndices": [
        33
      ],
      "transform": {
        "x": 0,
        "y": 0,
        "rotationDeg": 0,
        "scaleX": 1,
        "scaleY": 1,
        "opacity": 1,
        "pivot": {
          "x": 0,
          "y": 0
        }
      }
    },
    {
      "name": "asset_eye_r",
      "parent": "rig_eye_r",
      "kind": "asset",
      "source": "canonical-svg",
      "semanticPart": "eye_r",
      "sourceElementIndices": [
        34
      ],
      "transform": {
        "x": 0,
        "y": 0,
        "rotationDeg": 0,
        "scaleX": 1,
        "scaleY": 1,
        "opacity": 1,
        "pivot": {
          "x": 0,
          "y": 0
        }
      }
    },
    {
      "name": "asset_mouth",
      "parent": "rig_mouth",
      "kind": "asset",
      "source": "canonical-svg",
      "semanticPart": "mouth",
      "sourceElementIndices": [
        35,
        36,
        37
      ],
      "transform": {
        "x": 0,
        "y": 0,
        "rotationDeg": 0,
        "scaleX": 1,
        "scaleY": 1,
        "opacity": 1,
        "pivot": {
          "x": 0,
          "y": 0
        }
      }
    },
    {
      "name": "asset_stem",
      "parent": "rig_stem",
      "kind": "asset",
      "source": "canonical-svg",
      "semanticPart": "stem",
      "sourceElementIndices": [
        38,
        39,
        40,
        41
      ],
      "transform": {
        "x": 0,
        "y": 0,
        "rotationDeg": 0,
        "scaleX": 1,
        "scaleY": 1,
        "opacity": 1,
        "pivot": {
          "x": 0,
          "y": 0
        }
      }
    },
    {
      "name": "asset_base",
      "parent": "rig_base",
      "kind": "asset",
      "source": "canonical-svg",
      "semanticPart": "base",
      "sourceElementIndices": [
        42,
        43,
        44,
        45,
        46,
        47
      ],
      "transform": {
        "x": 0,
        "y": 0,
        "rotationDeg": 0,
        "scaleX": 1,
        "scaleY": 1,
        "opacity": 1,
        "pivot": {
          "x": 0,
          "y": 0
        }
      }
    }
  ],
  "animations": {
    "idle_breathe_blink": {
      "label": "Idle breathe + blink",
      "durationFrames": 72,
      "loop": true,
      "contactFrames": [
        0,
        18,
        38,
        55,
        72
      ],
      "tracks": {
        "rig_cup": {
          "scaleX": [
            {
              "frame": 0,
              "value": 1,
              "interpolation": "cubic",
              "curve": [
                0.42,
                0,
                0.58,
                1
              ]
            },
            {
              "frame": 6,
              "value": 1.002,
              "interpolation": "cubic",
              "curve": [
                0.42,
                0,
                0.58,
                1
              ]
            },
            {